{
  "incident_id": "INC-H10-002",
  "status": "insufficient_evidence",
  "suspected_root_cause": null,
  "confidence": 0.0,
  "confidence_method": "heuristic-v1",
  "signature_version": "1.0",
  "affected_devices": [],
  "affected_segments": [],
  "supporting_evidence": [],
  "agent_findings": [
    "F-CONN-01",
    "F-CONN-02",
    "F-CONN-03",
    "F-CONN-04",
    "F-CONN-05",
    "F-CONN-06",
    "F-CONN-07",
    "F-CONN-08",
    "F-CONN-09",
    "F-INF-453",
    "F-INF-454",
    "F-PERF-810",
    "F-PERF-811",
    "F-PERF-812",
    "F-PERF-813"
  ],
  "alternative_causes": [],
  "recommended_actions": [
    "Collect fresh performance, infrastructure and service/path measurements for the affected area, then re-run the diagnosis"
  ],
  "evidence_sources": [
    "connectivity_agent",
    "infrastructure_agent",
    "performance_agent"
  ],
  "limitations": [
    "healthy not shown: fresh performance measurements within normal range \u2014 not met",
    "no fault hypothesis was nominated with evidence; heuristic-v1 confidence 0.0"
  ],
  "normalization_log": [
    "records[15].metrics.cpu_utilization_pct: cpu_utilization_pct -> cpu_pct",
    "records[16].metrics.cpu_utilization_pct: cpu_utilization_pct -> cpu_pct",
    "records[17].metrics.cpu_utilization_pct: cpu_utilization_pct -> cpu_pct",
    "records[18].metrics.cpu_utilization_pct: cpu_utilization_pct -> cpu_pct",
    "records[19].metrics.cpu_utilization_pct: cpu_utilization_pct -> cpu_pct",
    "records[30].metrics.cpu_utilization_pct: cpu_utilization_pct -> cpu_pct",
    "records[31].metrics.cpu_utilization_pct: cpu_utilization_pct -> cpu_pct",
    "records[32].metrics.cpu_utilization_pct: cpu_utilization_pct -> cpu_pct",
    "records[33].metrics.cpu_utilization_pct: cpu_utilization_pct -> cpu_pct",
    "records[34].metrics.cpu_utilization_pct: cpu_utilization_pct -> cpu_pct",
    "ACC_LINK_07 at 2026-11-08T09:51:59+00:00: derived utilization 89.4175% from throughput/capacity",
    "ACC_LINK_07 at 2026-11-08T09:52:57+00:00: derived utilization 98.0608% from throughput/capacity",
    "ACC_LINK_07 at 2026-11-08T09:54:01+00:00: cross-check mismatch: measured 100% vs throughput/capacity 81.4923% (over 5 points) but both give the same verdict; measured value kept",
    "ACC_LINK_07 at 2026-11-08T09:54:01+00:00: derived utilization 81.4923% from throughput/capacity",
    "ACC_LINK_07 at 2026-11-08T09:54:58+00:00: cross-check mismatch: measured 99.53% vs throughput/capacity 79.1158%; they disagree about the verdict (critical 90% vs warn 80%), measured value marked malformed",
    "ACC_LINK_07 at 2026-11-08T09:54:58+00:00: derived utilization 79.1158% from throughput/capacity",
    "ACC_LINK_07 at 2026-11-08T09:55:47+00:00: cross-check mismatch: measured 100% vs throughput/capacity 70.2871%; they disagree about the verdict (critical 90% vs warn 80%), measured value marked malformed",
    "ACC_LINK_07 at 2026-11-08T09:55:47+00:00: derived utilization 70.2871% from throughput/capacity",
    "DEPT_UPLINK_01 at 2026-11-08T09:51:59+00:00: derived utilization 22.2713% from throughput/capacity",
    "DEPT_UPLINK_01 at 2026-11-08T09:52:57+00:00: cross-check mismatch: measured 17.08% vs throughput/capacity 22.3627% (over 5 points) but both give the same verdict; measured value kept",
    "DEPT_UPLINK_01 at 2026-11-08T09:52:57+00:00: derived utilization 22.3627% from throughput/capacity",
    "DEPT_UPLINK_01 at 2026-11-08T09:54:01+00:00: derived utilization 31.152% from throughput/capacity",
    "DEPT_UPLINK_01 at 2026-11-08T09:54:58+00:00: derived utilization 13.4334% from throughput/capacity",
    "DEPT_UPLINK_01 at 2026-11-08T09:55:47+00:00: derived utilization 17.8866% from throughput/capacity",
    "HOSTEL_UPLINK_01 at 2026-11-08T09:51:59+00:00: derived utilization 14.3187% from throughput/capacity",
    "HOSTEL_UPLINK_01 at 2026-11-08T09:52:57+00:00: cross-check mismatch: measured 19.09% vs throughput/capacity 29.3814% (over 5 points) but both give the same verdict; measured value kept",
    "HOSTEL_UPLINK_01 at 2026-11-08T09:52:57+00:00: derived utilization 29.3814% from throughput/capacity",
    "HOSTEL_UPLINK_01 at 2026-11-08T09:54:01+00:00: cross-check mismatch: measured 29.97% vs throughput/capacity 24.1324% (over 5 points) but both give the same verdict; measured value kept",
    "HOSTEL_UPLINK_01 at 2026-11-08T09:54:01+00:00: derived utilization 24.1324% from throughput/capacity",
    "HOSTEL_UPLINK_01 at 2026-11-08T09:54:58+00:00: derived utilization 14.9805% from throughput/capacity",
    "HOSTEL_UPLINK_01 at 2026-11-08T09:55:47+00:00: derived utilization 11.5409% from throughput/capacity"
  ],
  "validation_errors": [],
  "agent_trace_id": "INC-H10-002-TRACE"
}
