{
  "incident_id": "INC-H5-026",
  "status": "insufficient_evidence",
  "suspected_root_cause": null,
  "confidence": 0.0,
  "confidence_method": "heuristic-v1",
  "signature_version": "1.0",
  "affected_devices": [],
  "affected_segments": [],
  "supporting_evidence": [],
  "agent_findings": [
    "F-CONN-01",
    "F-CONN-02",
    "F-CONN-03",
    "F-CONN-04",
    "F-CONN-05",
    "F-CONN-06",
    "F-CONN-07",
    "F-CONN-08",
    "F-CONN-09",
    "F-INF-509",
    "F-INF-510",
    "F-PERF-913",
    "F-PERF-914",
    "F-PERF-915",
    "F-PERF-916"
  ],
  "alternative_causes": [],
  "recommended_actions": [
    "Collect fresh performance, infrastructure and service/path measurements for the affected area, then re-run the diagnosis"
  ],
  "evidence_sources": [
    "connectivity_agent",
    "infrastructure_agent",
    "performance_agent"
  ],
  "limitations": [
    "healthy not shown: fresh performance measurements within normal range \u2014 not met",
    "no fault hypothesis was nominated with evidence; heuristic-v1 confidence 0.0"
  ],
  "normalization_log": [
    "records[15].metrics.cpu_utilization_pct: cpu_utilization_pct -> cpu_pct",
    "records[16].metrics.cpu_utilization_pct: cpu_utilization_pct -> cpu_pct",
    "records[17].metrics.cpu_utilization_pct: cpu_utilization_pct -> cpu_pct",
    "records[18].metrics.cpu_utilization_pct: cpu_utilization_pct -> cpu_pct",
    "records[19].metrics.cpu_utilization_pct: cpu_utilization_pct -> cpu_pct",
    "records[30].metrics.cpu_utilization_pct: cpu_utilization_pct -> cpu_pct",
    "records[31].metrics.cpu_utilization_pct: cpu_utilization_pct -> cpu_pct",
    "records[32].metrics.cpu_utilization_pct: cpu_utilization_pct -> cpu_pct",
    "records[33].metrics.cpu_utilization_pct: cpu_utilization_pct -> cpu_pct",
    "records[34].metrics.cpu_utilization_pct: cpu_utilization_pct -> cpu_pct",
    "ACC_LINK_10 at 2026-11-06T19:26:05+00:00: derived utilization 95.5% from throughput/capacity",
    "ACC_LINK_10 at 2026-11-06T19:27:18+00:00: derived utilization 91.8% from throughput/capacity",
    "ACC_LINK_10 at 2026-11-06T19:28:02+00:00: derived utilization 97% from throughput/capacity",
    "ACC_LINK_10 at 2026-11-06T19:29:12+00:00: derived utilization 97.1% from throughput/capacity",
    "ACC_LINK_10 at 2026-11-06T19:30:10+00:00: derived utilization 94.3% from throughput/capacity",
    "DEPT_UPLINK_01 at 2026-11-06T19:26:05+00:00: derived utilization 18.2% from throughput/capacity",
    "DEPT_UPLINK_01 at 2026-11-06T19:27:18+00:00: derived utilization 22.3% from throughput/capacity",
    "DEPT_UPLINK_01 at 2026-11-06T19:28:02+00:00: derived utilization 19% from throughput/capacity",
    "DEPT_UPLINK_01 at 2026-11-06T19:29:12+00:00: derived utilization 8.1% from throughput/capacity",
    "DEPT_UPLINK_01 at 2026-11-06T19:30:10+00:00: derived utilization 12.3% from throughput/capacity",
    "HOSTEL_UPLINK_01 at 2026-11-06T19:26:05+00:00: derived utilization 16.4% from throughput/capacity",
    "HOSTEL_UPLINK_01 at 2026-11-06T19:27:18+00:00: derived utilization 9.2% from throughput/capacity",
    "HOSTEL_UPLINK_01 at 2026-11-06T19:28:02+00:00: derived utilization 7.7% from throughput/capacity",
    "HOSTEL_UPLINK_01 at 2026-11-06T19:29:12+00:00: derived utilization 14.1% from throughput/capacity",
    "HOSTEL_UPLINK_01 at 2026-11-06T19:30:10+00:00: derived utilization 7.5% from throughput/capacity"
  ],
  "validation_errors": [],
  "agent_trace_id": "INC-H5-026-TRACE"
}
